{
  "$schema": "https://json-schema.org/draft/2020-12/schema",
  "$id": "https://superspec.dev/schemas/workflow-v1.json",
  "title": "SuperSpec Workflow Schema",
  "type": "object",
  "required": [
    "workflowId",
    "version",
    "steps"
  ],
  "properties": {
    "workflowId": {
      "type": "string",
      "minLength": 1
    },
    "version": {
      "type": "string",
      "minLength": 1
    },
    "description": {
      "type": "string"
    },
    "steps": {
      "type": "array",
      "minItems": 1,
      "items": {
        "type": "object",
        "required": [
          "id",
          "description",
          "executor"
        ],
        "properties": {
          "id": {
            "type": "string",
            "minLength": 1
          },
          "description": {
            "type": "string",
            "minLength": 1
          },
          "dependsOn": {
            "type": "array",
            "items": {
              "type": "string",
              "minLength": 1
            },
            "uniqueItems": true
          },
          "executor": {
            "enum": [
              "skill",
              "script",
              "human"
            ]
          },
          "skill": {
            "type": "string",
            "minLength": 1
          },
          "script": {
            "type": "string",
            "minLength": 1
          },
          "prompt": {
            "type": "string"
          },
          "human": {
            "type": "object",
            "properties": {
              "instruction": {
                "type": "string",
                "minLength": 1
              }
            },
            "required": [
              "instruction"
            ],
            "additionalProperties": false
          }
        },
        "allOf": [
          {
            "if": {
              "properties": {
                "executor": {
                  "const": "skill"
                }
              }
            },
            "then": {
              "required": [
                "skill"
              ],
              "not": {
                "anyOf": [
                  {
                    "required": [
                      "script"
                    ]
                  },
                  {
                    "required": [
                      "human"
                    ]
                  }
                ]
              }
            }
          },
          {
            "if": {
              "properties": {
                "executor": {
                  "const": "script"
                }
              }
            },
            "then": {
              "required": [
                "script"
              ],
              "not": {
                "anyOf": [
                  {
                    "required": [
                      "skill"
                    ]
                  },
                  {
                    "required": [
                      "human"
                    ]
                  }
                ]
              }
            }
          },
          {
            "if": {
              "properties": {
                "executor": {
                  "const": "human"
                }
              }
            },
            "then": {
              "required": [
                "human"
              ],
              "not": {
                "anyOf": [
                  {
                    "required": [
                      "skill"
                    ]
                  },
                  {
                    "required": [
                      "script"
                    ]
                  }
                ]
              }
            }
          }
        ],
        "additionalProperties": false
      }
    },
    "metadata": {
      "type": "object",
      "additionalProperties": true
    }
  },
  "additionalProperties": false
}
