{
    "workflowId": "code-review",
    "version": "1.2.0",
    "description": "Workflow for requesting and receiving code reviews as part of the spec-driven development process",
    "steps": [
        {
            "id": "a1",
            "description": "request-code-review",
            "executor": "skill",
            "skill": "requesting-code-review"
        },
        {
            "id": "a2",
            "description": "report-review",
            "dependsOn": [
                "a1"
            ],
            "executor": "human",
            "prompt": "Paste the COMPLETE raw response from the code-reviewer agent to `superspec/changes/<change_name>/report.md`."
        },
        {
            "id": "a3",
            "description": "receive-code-review-and-fix",
            "dependsOn": [
                "a2"
            ],
            "executor": "skill",
            "skill": "receiving-code-review"
        },
        {
            "id": "a4",
            "description": "superspec-git",
            "dependsOn": [
                "a3"
            ],
            "executor": "script",
            "script": "superspec git commit <change-name> --summary \"<subject>\" --details \"<body>\" --next \"<next>\"",
            "prompt": "Fill in the parameters and execute the command. Specifically: `summary`- a one-sentence title that *must* begin with a verb and focus on the primary change introduced by this commit; `details`(Optional) - 2 to 6 lines explaining what this commit accomplished, which parts were affected, and the rationale behind the changes; `next`- what is planned for the next step, or what requires attention."
        }
    ]
}